category,qns_no,qns,ans
New Student Onboarding/GT Email Account,1,Where do I send my official transcript(s) and other official documents?,"Send your final official transcript(s) and other official documents to the Office of Graduate Education at:
Office of Graduate Education
Georgia Institute of Technology
631 Cherry Street, Room 301
Atlanta, GA 30332-0321
Phone: 404.894.1610
Email: transcripts@grad.gatech.edu"
New Student Onboarding/GT Email Account,2,What happens if I do not submit my official transcript(s) and any other required official documents?,"If you are a new student starting Spring 2024, you will NOT have a missing document hold placed on your
account for transcripts until after registration has ended.
However, you will want to ensure that you submit all required official transcripts/documents as soon as possible to
avoid future holds, especially since those holds could prevent your ability to withdraw from a course in your first
semester, as well as your ability to register/withdraw from future semesters."
New Student Onboarding/GT Email Account,3,Is there an orientation for the OMSCS program?,"Since this is an online program, we do not have a formal or in-person orientation for OMSCS students through the
OMSCS Advising office. However, we encourage you to access general onboarding information online. Next, we
encourage you to watch our OMSCS Orientation video playlist. Finally, a wiki was created for new and existing
students in the OMSCS program, but please note that since OMSCS Advising did not contribute to this document,
we cannot guarantee that all of the information is up-to-date and fully accurate."
New Student Onboarding/GT Email Account,4,What are the expectations regarding my GT email account?,"The Institute, as well as the department, will use your Georgia Tech email address as your official contact.
You are required to keep it active, and you are expected to read your email DAILY as per the Institute’s
policy. This is true even if you are not enrolled that particular semester.
***Also, even if you have arranged for your GT email to be forwarded to your personal account, we encourage you
to check your GT email account directly and often, as we have heard from students on multiple occasions that
their forwarding service did not always work properly. No exceptions will be made simply because you missed an
email that was sent by our department and/or the Institute.***
Please pay special attention to any messages sent from omscs-official@cc.gatech.edu, as important
announcements typically are sent from this account. Since this account is the official mailing list for all OMSCS
students, please do NOT reply or send messages to this account, as this could result in all OMSCS students
receiving your message. All OMSCS students are required to be subscribed to this email list, and only Georgia
Tech email accounts can be added.
While it is not required, we also encourage students to subscribe to the omscs-announce@cc.gatech.edu account
for non-academic events and announcements. You may do this by visiting this webpage.
Finally, students will be added automatically to the OMSCS Student Center in Canvas, and they will receive the
OMSCS Weekly Digest (omscs-digest@lists.gatech.edu)."
New Student Onboarding/GT Email Account,5,How can I access my GT email account?,"Please visit this website for information on how to access your GT email account. We recommend bookmarking
https://mail.gatech.edu so that you can access your GT email account quickly.
Click here to return to Table of Contents
9"
New Student Onboarding/GT Email Account,6,For what purpose will I use my GT email account?,"Please contact all Georgia Tech offices and employees (including OMSCS Advising and your instructors) from
your Georgia Tech email account ending in @gatech.edu. Please do not communicate using your personal email
account. If you do, you will be asked to resubmit your request from your GT email account. This is necessary as
a security step, as we cannot verify the legitimacy of personal email accounts. In that same regard, OMSCS
Advising will only communicate with you through your GT email account.
Also, please keep in mind that registration information, including wait list notifications, will be sent to your GT
email account. As stated previously, even if you have arranged for your GT email to be forwarded to your
personal account, we encourage you to check your GT email account directly, as we have heard from students on
multiple occasions that their forwarding service did not always work properly. No exceptions will be made simply
because you missed an email that was sent by our department and/or the Institute, including wait list notifications."
New Student Onboarding/GT Email Account,7,When will newly-admitted students be added to the official OMSCS mailing list?,"For newly-admitted OMSCS students, OMSCS Advising will send important information to the email account you
listed on your application until you are added to the official OMSCS mailing list (omscs-official@cc.gatech.edu).
This typically will not take place until after Phase II registration has ended. Please note that you may receive
messages twice as we are updating the omscs-official@cc.gatech.edu mailing list. Your patience with this
process is greatly appreciated."
New Student Onboarding/GT Email Account,8,"Who do I contact if I have questions about or issues with my GT email account and/or OSCAR, including","my account being deactivated, if I get locked out of my account, or if I want to set up email forwarding?
Please contact the Office of Information Technology (OIT) for assistance with accessing your GT accounts."
New Student Onboarding/GT Email Account,9,Do I need to set up Two-Factor Authentication/Duo?,"Two-factor authentication is required for all GT students. Please follow the directions online to set up Duo.
Failing to set up Duo will result in being locked out of your account. For assistance, please contact OIT.
Institute Services & Course-Related Resources"
Institute Services & Course-Related Resources,1,I have a documented disability. How do I find out what resources are available to me?,"Please contact the Office of Disability Services, which is a division of the Dean of Students office. The website is:
http://disabilityservices.gatech.edu."
Institute Services & Course-Related Resources,2,Am I eligible to obtain a BuzzCard (student ID) if I am an OMSCS student?,"Yes, this is possible for online students. Please visit this webpage for more information regarding this process.
Students also can obtain their BuzzCard in person when visiting Georgia Tech's campus. For more information,
including the location of the Georgia Tech BuzzCard office, please visit their website."
Institute Services & Course-Related Resources,3,"What is my nine-digit gtID number (90XXXXXXX) used for, and where can I find it?","This nine-digit number was included in your admission letter. You also can visit this webpage for assistance. You
will need to include this nine-digit number every time you contact our office so that we can access your student
record, but please be sure to replace the first two digits with “xx” for security purposes. Your gtID number should
generally only be shared with your advisors and instructors, as well as other relevant Georgia Tech offices (such
as the Registrar’s Office, the Office of Graduate Education, etc.). Otherwise, it is meant to be private."
Institute Services & Course-Related Resources,4,"What if I have a personal or family emergency and need an extension on an assignment or exam, or I need to withdraw from a class or from school after the deadline due to an extenuating circumstance?","
The worst thing you can do is not tell anyone! Your first point of contact should be your TA and/or professor if
something has come up with work, family, etc. If your TA and/or professor would like you to go through the Dean
of Students office, their website is: https://studentlife.gatech.edu/. Specifically, we encourage you to visit
https://studentlife.gatech.edu/request-assistance."
Institute Services & Course-Related Resources,5,What mental health resources are available to me as an online graduate student at Georgia Tech?,"Your mental health is important, and we want all OMSCS students to access local resources wherever they live,
as well as utilize the online information available to the full GT community. The Georgia Tech Dean of Students
Click here to return to Table of Contents
10


Office can assist with academic and other concerns. A source for excellent online mental health and well-being
information can be found at https://gtwellnesshub.com/.
Additionally, please note the following resources:
●
JED Foundation
●
Trevor Lifeline (supports LGBTQIA youth): 866-488-7386
●
Crisis Chat Line (a 24/7 text-based crisis service)
●
National Suicide Prevention Lifeline: 988
●
GT students can access self-help resources, including apps and podcasts, online. Please note that
students must have a valid @gatech.edu email address."
Institute Services & Course-Related Resources,6,I am interested in becoming a TA. Is this possible?,"Each semester, an email is sent to the omscs-official@cc.gatech.edu account notifying students of how to apply to
become a TA for a future semester. Please be sure to monitor your email for this information."
Institute Services & Course-Related Resources,7,What if I have an issue with/complaint about an assignment/exam or my instructor/TA?,"Unfortunately, OMSCS Advising cannot get involved in the classroom management of OMSCS courses. If you
need to request an extension due to health, family, or other unforeseen issues, please consult your class’ syllabus
for directions and/or contact the Dean of Students office using the Request Assistance form, available on their
website.
If you have a dispute with your grade, you should first contact your instructor. As per the academic catalog, any
final grade dispute must be resolved by the end of your next enrolled term. Any student with a grade dispute that
cannot be resolved after contacting the instructor should open a ticket at oms-advising@cc.gatech.edu with the
subject line ""Grade Dispute – Your Name"". Please send this message from your GT email account and attach
any correspondence with the instructor that you have had regarding the issue when you open that ticket.
If you would like to share feedback about a class that is not specifically related to your grade, please contact the
Associate Director for Student Experience, Alex Duncan (alex.duncan@gatech.edu)."
Institute Services & Course-Related Resources,8,What if I have an issue with/complaint against a fellow student in the program?,"Student behavior while enrolled in the OMSCS program is governed by the Georgia Tech Student Code of
Conduct. This policy applies to all official interaction on program platforms and also to a certain extent where
students interact with each other in program-oriented communities that are not officially administered by the
Institute. If you believe a violation of the Student Code of Conduct has occurred, you may seek assistance from
the Dean of Students office by clicking “Request Assistance” on their website."
Institute Services & Course-Related Resources,9,What are the technical requirements for the OMSCS program?,"Please visit this webpage to learn more about the minimum technical requirements for the OMSCS program.
Please note that individual courses may have additional requirements, but the ones listed on the webpage are
common across all OMSCS courses. Also, please note that courses with proctored exams may require you to
use Google Chrome to take the exam."
Institute Services & Course-Related Resources,10,Will my accounts be disabled if I travel to a different country while enrolled in OMSCS courses?,"We are not sure if there is a way to prevent this from happening, but we strongly recommend that you contact the
Technology Services Organization (TSO) for assistance if you encounter this. You also may need to contact the
Office of Information Technology (OIT)."
Institute Services & Course-Related Resources,11,"How can I determine if there is a system outage, as well as stay informed of scheduled downtime for network maintenance?","
Please visit https://support.cc.gatech.edu/alerts to stay up-to-date about system outages and scheduled
maintenance that occurs within the College of Computing. This webpage also links to other helpful resources
available on OIT’s website, including https://status.gatech.edu/."
Institute Services & Course-Related Resources,12,Are OMSCS students eligible to earn credit for internships?,"The Graduate Internship Program is often used by graduate students as a means to maintain full-time student
status while interning throughout the year. Since OMSCS students can only be enrolled as part-time students,
Click here to return to Table of Contents
11


there is no added benefit to enrolling in the Graduate Internship Program. OMSCS students are welcome to
pursue internship experiences should their schedules allow for it."
Institute Services & Course-Related Resources,13,What career resources are available to me as an OMSCS student?,"OMSCS students can receive career support from multiple sources. First, OMSCS students have access to
career services specifically for assistance with job searching, interviewing, networking, career planning, and
professional development. Please visit https://omscs.gatech.edu/career to learn more. If you sign up for the
omscs-announce mailing list, you will receive regular communications from the Office of Outreach, Enrollment,
and Community (OEC) for the College of Computing, including opportunities to participate in professional
development workshops and webinars.
Also, please be sure to check out our job platform, Handshake (you will be required to log in using your GT
credentials). Here, OMSCS students can see current industry job and internship opportunities, register and
attend College of Computing events, network with students across the nation, and request appointments with a
Career Advisor. Newly-matriculated students may not be able to access Handshake until a couple of weeks after
the semester begins.
Career coaching can be provided by reaching out to the Educational Outreach Manager, Troy Peace
(tpeace@cc.gatech.edu). We also recommend that you contact your undergraduate and/or former graduate
school for alumni services.
Finally, OMSCS students have access to services for graduate students offered by the Career Center at Georgia
Tech. The Career Center offers workshops on many of the topics listed above, a job board that lists internships
and full-time jobs, and career fairs. The platform that is used within the Career Center is CareerBuzz, where you
can explore all of the services and events that are offered by the Career Center. All OMSCS students are granted
access to the platform once they formally enroll in classes."
Institute Services & Course-Related Resources,14,Can OMSCS students participate in the on-campus and virtual Georgia Tech career fairs?,"OMSCS students are eligible to participate in the on-campus and virtual College of Computing career fairs and
the Georgia Tech Career Center. Please note that BuzzCards are required for the on-campus career fairs."
Institute Services & Course-Related Resources,15,How do I find out more information about the Vertically Integrated Projects (VIP) program?,"OMSCS students who are interested in participating in the Vertically Integrated Projects (VIP) program should
contact that department directly. Their contact information can be found on their website. If you receive approval
from their program to participate, please keep the following in mind:
●
The courses can only be counted toward your MSCS degree as “free” elective credit. You may not count
these courses to fulfill any specialization requirements.
●
Since the course in which you would enroll has the “VIP” prefix, this will count toward the six-hour
maximum of non-CS/CSE and/or 4000-level courses that MSCS students can apply toward their degree.
●
The credit you earn for the VIP program does not count as a foundational course for the OMSCS
program. Therefore, you are still required to fulfill your foundational requirement by your designated
deadline, if you have not done so already.
●
If you have any additional questions regarding the VIP program, please contact their office directly, as the
OMSCS advisors are unable to provide specific information regarding that program or its requirements."
Institute Services & Course-Related Resources,16,Is the OMSCS program accredited?,"Georgia Tech’s undergraduate programs are ABET (Accreditation Board for Engineering and Technology)
accredited. Georgia Tech’s graduate programs are regionally accredited by the Southern Association of Colleges
and Schools Commission on Colleges (SACS)."
Institute Services & Course-Related Resources,17,How can I obtain an enrollment verification?,"Please visit this webpage for more information on how to request an enrollment verification, and please contact
the Registrar’s Office directly with any questions.
Click here to return to Table of Contents
12"
Institute Services & Course-Related Resources,18,How do I get support for the various systems I will use as an OMSCS student?,"During your coursework in the OMSCS program, you will interact with a number of different third-party vendors
who supply specific functions. You may encounter issues that only the third-party support staff can resolve. In the
event that you encounter technological issues with a third-party vendor, please pursue support using the channel
lists below.
Please note that any interaction you have with the support staff of a third-party vendor is considered part of your
conduct as a Georgia Tech student and is thus subject to rules regarding Student Conduct. Any abusive
language, misrepresentation of your identity, or other instances of misconduct may be referred to the Office of
Student Integrity for investigation and possible sanctions.
●
Canvas
○
For student support with Canvas, log into Canvas, then click the question mark icon at the bottom
left. Then, either call the Canvas Support Hotline or Chat with Canvas Support for students.
○
If you are unable to log into Canvas, contact canvas@gatech.edu.
●
Honorlock
○
If you have difficulty with Honorlock, open Honorlock in Canvas, then click the “Need help?”
button in the top right or the chat icon in the bottom right to chat with Honorlock support.
●
Piazza
○
If you have difficulty with Piazza, visit support.piazza.com.
●
Gradescope
○
If you have difficulty with Gradescope, log in, click “Account” in the bottom left, and click “Help”.
Deferring Admission"
Deferring Admission,1,"If I am not able to attend during the term I was admitted, what are my options?","It may be possible to defer your admission if you do not matriculate into the OMSCS program. Applications are
good for one year from the term for which you applied originally. For example, if you originally applied for the
Spring 2024 term, and you did not enroll in any classes/matriculate, it may be possible to request a deferral for the
Fall 2024 OR Spring 2025 term. If you want to matriculate after Spring 2025, you would need to reapply to the
OMSCS program.
Please note that deferral requests can be processed only for the fall and spring semesters.
Also, per the new Office of Graduate Education policy, an admitted applicant may only defer their
admission one time during the one-year timeframe that an application is valid.
In order to request to defer your admission, please send an email to oms-advising@cc.gatech.edu from the
personal email address listed on your application. In the subject line, please include the phrase “Deferral
Request”, your full name, and your nine-digit gtID number (90XXXXXXX), replacing the first two digits with “xx”.
In your email, please include your original application term and the term to which you would like to defer your
admission.
○
If you would like to defer to the Fall 2024 semester, please send your deferral request after February 1, 2024
but before May 1, 2024 ○ If you would like to defer to the Spring 2025 semester, please send your deferral request after September 1,
2024 but before October 1, 2024
**It is best to submit your deferral request earlier rather than later during the designated time frame to allow enough time for processing both within the College of Computing and the Office of Graduate
Education.**
For students who are required to complete an English proficiency exam, please note that those scores are only
valid for two years from the date taken. For more information regarding English proficiency scores, please visit
the Office of Graduate Education’s website.
Click here to return to Table of Contents
13"
Deferring Admission,2,What does it mean to matriculate into the OMSCS program?,"When students register for a course(s) during their first semester in the program and remain enrolled after the
Phase II registration period has ended, they will have a record of enrollment for the semester and will be
considered a matriculated (current) student. This is true even if a student later decides to withdraw from a course
by the semester’s deadline, as the “W” on the transcript will still count as a record of enrollment for the semester.
Students are not considered matriculated (current) students if they register for a course(s) during their first
semester in the program but then drop their schedule before the Phase II registration period has ended."
Deferring Admission,3,How do I know if I need to submit a deferral request?,"Please note the following when determining whether a deferral request needs to be submitted:
●
If a student registers and remains enrolled after Phase II registration has ended, they are considered a
matriculated (current) OMSCS student and do not need to request to defer their admission, even if they
withdraw from a course in their first semester.
●
If a student registers but drops their schedule before Phase II registration has ended, they are not
considered a matriculated (current) OMSCS student and must submit a request to defer their admission
within the designated time frame, as long as they meet the eligibility requirements. Please review the
previous FAQs for more details.
○
Note: If your schedule is cancelled for nonpayment, you will NOT have a record of enrollment for
the semester. Therefore, if this is your first semester in the OMSCS program, you will need to
defer your admission, if you are eligible to do so."
Deferring Admission,4,"If I am planning to defer my admission, what do I need to do?","If you are planning to defer your admission, there is nothing you need to do except not register for courses that
term. You simply will need to follow up with our office to request a deferral during the time frame noted above. As
a reminder, it is best to submit your deferral request earlier rather than later during the designated time frame to
allow enough time for processing both within the College of Computing and the Office of Graduate Education.
Please keep in mind that registering for and later withdrawing from a course (which results in a “W” on your
transcript) means you are no longer eligible to defer your admission, as you are considered a matriculated
(current) student."
Deferring Admission,5,How many times am I permitted to defer my admission?,"As per the new Office of Graduate Education policy, an admitted applicant may only defer their admission one
time during the one-year timeframe that an application is valid.
To clarify further, if your original application term is Spring 2024, you can defer to Fall 2024 or to Spring 2025 –
you may not defer to Fall 2024 and then later request to defer to Spring 2025. If you deferred to Fall 2024 or Spring 2025 and did not matriculate, you would be required to submit a new application and be offered admission
again to be permitted to matriculate as an OMSCS student."
Deferring Admission,6,Why do I need to submit my deferral request after registration has ended and the semester has started?,"Due to the number of admitted students the College of Computing and the Office of Graduate Education are
supporting at the start of the semester during Phase II registration, deferral requests are not processed until after
the registration period has ended and the semester has started. Additionally, there have been times when
admitted students request for their admission to be deferred, and then their circumstances change, and they
decide that they do want to enroll for their original admit term. Therefore, the College of Computing and the Office
of Graduate Education do not start processing deferral requests until the time frames noted above."
Deferring Admission,7,"I am scheduled to matriculate this semester, but I cannot enroll for the course I want because the course is full. Can I defer my admission to the next term so that I can enroll in the specific course I want?","
If you are considering deferring your admission only because you cannot enroll in the specific course(s) you wish
to take, we strongly do not recommend pursuing the deferral, as you will be in the same situation the next term
since new students do not register until Phase II."
