category,qns_no,qns,ans
Deferring Admission,8,"If I defer my admission, when does my one-year time frame start for my foundational requirement?","If you do not matriculate, and you defer your admission to a future term, then your foundational requirement time
frame would start with your new matriculation term. For example, if you were admitted for Spring 2024 but did not
matriculate until Fall 2024, you would have the Fall 2024, Spring 2025, and Summer 2025 terms to fulfill the
Click here to return to Table of Contents
14


foundational requirement.
However, please remember that if you matriculate into the program, your foundational requirement time frame
would begin, even if you withdraw from a course that term (since a “W” counts as a record of enrollment). For
example, if you matriculated into the program as of Spring 2024 and later withdrew, that term (Spring 2024) still
would count toward your foundational requirement time frame."
Deferring Admission,9,"I deferred my admission (or I am planning to defer my admission) and received a message indicating that my accounts are being inactivated. Can they remain active even though I am not a currently-enrolled
student since I plan to enroll in a future term?","If you are not enrolled and are not classified as a student who is eligible to enroll, your student-related services
will be discontinued. It is our understanding that OIT will not extend these student-related services until you are
eligible to enroll. For example, if you were admitted for Spring 2024 but deferred your admission to Fall 2024, you
would not have access to your accounts during the Spring 2024 semester but would regain access as the Fall
2024 semester approached."
Deferring Admission,10,"I submitted a deferral request, but now I am being informed that I will be losing access to my GT accounts, including email. How will you communicate with me?","
As noted previously, if you are not enrolled and are not classified as a student who is eligible to enroll, your
student-related services will be discontinued. Therefore, we will communicate with you using the personal email
account you listed on your application. Additionally, you may submit your deferral request from this personal
email account – your request does not need to be submitted from your GT email account."
Deferring Admission,11,Why am I still receiving registration-related emails if I am deferring my admission?,"Since deferral requests are not processed until after the semester starts, you most likely will continue to receive
registration-related emails as an admitted student for the term. If you wish to be removed from that semester’s
new-student mailing list, please send a message to oms-advising@cc.gatech.edu. Please include your full name
and your nine-digit gtID number (90XXXXXXX), replacing the first two digits with “xx”.
Degree Requirements"
Degree Requirements,1,What are the degree requirements for the OMSCS program?,"The OMSCS degree requires 30 hours (10 courses). Students must declare one specialization, which, depending
on the specialization, is 15-18 hours (5-6 courses). The remaining 12-15 hours (4-5 courses) are “free” electives
and can be any courses offered through the OMSCS program. You can review the degree requirements online.
The requirements for each specialization can be found online as well. Please note that courses listed in bold
have been produced for the OMSCS program.
To be able to continue in the program after the first 12 months from your date of matriculation, you must complete
the foundational requirement of two foundational courses with a grade of “B” or better. You may choose a
foundational course that counts towards any area of your degree, whether a specialization requirement or a ""free""
elective. The courses that constitute “foundational courses” are designated with an asterisk (*) on the current
courses page of our website."
Degree Requirements,2,"By when do I need to declare my specialization, and how can I do so? Can I change my specialization once I declare it?","
We strongly recommend that you declare your specialization after your first two semesters in the program or as
soon as you have an idea as to which specialization you plan to pursue. Your specialization needs to be declared
by the time you apply to graduate. Please note that you are not “locked in” once you declare your specialization.
You may change your specialization any time that does not conflict with an active period of registration.
To declare your specialization, please follow these instructions:
●
Go to https://oscar.gatech.edu/.
●
Sign in using your GT credentials via the “Secure Access Login” link.
Click here to return to Table of Contents
15


●
Click on the “Students” tab.
●
Scroll down and select “Change Your Concentration”. Listed on this screen will be your current program
of study, effective for a future term. Beside each program of study is a button that allows you to select the
program for which you would like to add, update, or remove a specialization/concentration.
●
Once selected, click the “Select Program” button to proceed.
●
The next screen will list the program of study that was selected from the previous screen with an
additional line labeled, “Major Concentration”. Next to this will be a drop-down box that will list all the
concentrations (specializations) that are available for that specific program of study and term. Select your
desired concentration (specialization) and click “Submit Changes”.
●
To remove a concentration (specialization) that previously has been attached to the program of study,
select “None” from the drop-down list and click “Submit Changes”.
●
The next screen will show a confirmation of the changes that were made.
●
Click “Done”, and you will return to the main screen displaying your current program of study.
●
Once you arrive back at the main screen, review the changes you have made and ensure you have
added/removed/modified the appropriate concentration (specialization) for all current and future terms.
**Please note that if you are receiving GI Bill benefits, the Department of Veteran Affairs (DVA) regulates that only
degree-applicable courses for your major are allowed to be certified for tuition and fee funding. This particular
student population is permitted no more than two semesters to declare a specialization. By declaring your
specialization, this will allow Georgia Tech’s Veteran’s Services office to certify your courses each semester.
Please contact the Veteran's Services office directly with any questions you may have regarding this requirement.
Their contact information can be found on their website."
Degree Requirements,3,Can I declare more than one specialization?,"No – students may declare only one specialization. However, you may take courses beyond your specialization
as “free” electives."
Degree Requirements,4,Can I use extra specialization core courses as specialization electives (and vice versa)?,"For the most part, if students take extra specialization core courses and/or extra specialization elective courses
beyond what is required in their specialization, the extra course(s) can be used only towards the ""free"" electives.
In other words, specialization core courses cannot be used towards the specialization elective requirements and
vice versa (specialization elective courses cannot be used towards the specialization core requirements).
The only exception is for students pursuing the Computing Systems specialization. Please visit the
specialization’s webpage for more information regarding what can be accepted."
Degree Requirements,5,Am I allowed to make substitutions within the OMSCS degree requirements?,"The official College policy is that substitutions for specialization coursework are made only when necessary when
specialization courses are not available. Since all five of the specializations offered through the OMSCS program
can be completed without substitutions, no substitutions will be approved."
Degree Requirements,6,Am I allowed to audit a course or take it on the pass/fail grading basis?,"Students are permitted to earn only a letter grade in all OMSCS courses. Students may not audit an OMSCS
course or take it on the pass/fail grading basis.
The only exception is the CS 8001 one-hour seminars. As a reminder, these seminars are graded on the pass/fail
grading basis and will NOT count toward your graduation requirements."
Degree Requirements,7,How long do I have to complete the program and earn my degree?,Students must complete the OMSCS degree in six years as per the Institute’s policy.
Degree Requirements,8,What happens if I need more than six years to complete the program?,"Any coursework that is older than six years needs to be approved by the Graduate Curriculum Committee (GCC)
and the Institute Graduate Curriculum Committee (IGCC) in order to be applied to your degree. If you will be
exceeding the six-year time frame, please be sure to contact oms-advising@cc.gatech.edu the semester before
Click here to return to Table of Contents
16


you plan to graduate so that you can work with your advisor on obtaining approval to use the older coursework.
Please be sure to send your message from your GT email account and to include your full name and your
nine-digit gtID number (90XXXXXXX), replacing the first two digits with “xx”."
Degree Requirements,9,Can I count non-CS/CSE courses and/or previously-completed undergraduate-level courses toward my MSCS degree?,"
As per the program rules, a maximum of six hours may be taken at the 4000-level and/or with a subject code
other than CS or CSE. If you have any questions, especially regarding previously-completed undergraduate-level
courses, please contact your advisor by sending a message from your GT email account to
oms-advising@cc.gatech.edu. Please be sure to include your nine-digit gtID number (90XXXXXXX), replacing
the first two digits with “xx”."
Degree Requirements,10,What are the rules regarding the Satisfactory Academic Progress policy?,"Please visit https://catalog.gatech.edu/rules/6/ for information regarding the Satisfactory Academic Progress
policy.
Foundational Requirement"
Foundational Requirement,1,"My admission letter states: “All incoming students are admitted conditionally. To continue in the program after the first 12 months from your date of matriculation, you must complete the foundational
coursework requirement of 2 courses in the program with a grade of B or better.” Will I be notified when I
am fully admitted into the OMSCS program?","As stated previously, to be able to continue in the program after the first 12 months from your date of
matriculation, you must complete a foundational coursework requirement of two foundational courses with a grade
of “B” or better. The courses that constitute “foundational courses” are designated with an asterisk (*) on this
webpage.
We do not send notifications for students who have completed their foundational requirement. If you would like to
verify that you have completed your foundational requirement, please refer to the link above to determine if the
courses you have completed successfully are considered to be foundational courses."
Foundational Requirement,2,Do my foundational courses have to be a part of my intended/declared specialization?,"No — you may choose a foundational course that counts towards any area of your degree, whether a
specialization requirement or a ""free"" elective."
Foundational Requirement,3,"Can I register for non-foundational courses for a future term if I am on track to finish the foundational requirement by the end of this term (either I am enrolled in two foundational courses, or I am enrolled in
my second foundational course)?","If you are enrolled in two foundational courses or your second foundational course, you would not be eligible to
enroll in any non-foundational courses until you successfully completed the two foundational course(s) with a ""B""
or better.
To clarify, during Phase I registration, you would be restricted to enrolling only in foundational courses. If you
successfully completed the requirement by the end of the current term, the restriction would be lifted shortly after
grades had been posted, and you would have an opportunity to make adjustments to your future schedule during
Phase II."
Foundational Requirement,4,What happens if I do not meet my foundational requirement by my designated deadline?,"As of now, students have not been dismissed from the OMSCS program simply for not fulfilling the foundational
requirement. Students will need to continue enrolling in foundational courses until they have satisfied this
requirement. Our office sends an email each semester for students whose foundational requirement deadline has
passed, so please refer to these messages for any updated information regarding this policy.
Course/Program Planning"
Course/Program Planning,1,Which semesters are OMSCS courses offered?,"OMSCS courses are offered during the spring, summer, and fall semesters. However, the summer offerings are
much more limited due to the condensed time frame of the semester. Students are not required to enroll in each
term consecutively, but please make note of the readmission policy if you plan not to enroll during a specific
Click here to return to Table of Contents
17


semester(s) (please see the “Taking Time Off” section in the FAQs for more information)."
Course/Program Planning,2,"For the summer semester, are OMSCS courses offered as part of the “Early Short Summer” or “Late Short Summer” schedule?","
All OMSCS summer courses are “Full Summer” courses. Our program does not offer any “Early Short Summer”
or “Late Short Summer” courses."
Course/Program Planning,3,Are there plans to add more courses and/or specializations to the OMSCS program?,"At this time, all of the courses/specializations that will be offered with the OMSCS program are listed on our
website. The advisors unfortunately do not have any additional information other than the information that is
posted on our website."
Course/Program Planning,4,Can I take on-campus and/or Distance Learning (DL) courses as an OMSCS student?,"Unfortunately, OMSCS students are not eligible to enroll in on-campus or DL courses, as they are considered to
be a different campus and have different tuition rates/fees. Likewise, on-campus or DL students are not eligible to
enroll in OMSCS courses."
Course/Program Planning,5,Can I enroll in courses offered through the OMS Analytics and/or OMS Cybersecurity programs as an OMSCS student?,"
Sections for OMSCS students have been created for a select number of OMS Analytics and OMS Cybersecurity
courses. If a section of an OMS Analytics or OMS Cybersecurity course has been created for OMSCS students, it
will have a section of “O” followed by a two-digit number (example: O01, O02, O03, etc.). As a reminder, courses
designated with the “OAN” section are reserved for OMS Analytics students, and courses designated with the
“OCY” section are reserved for OMS Cybersecurity students. Therefore, please be sure you are selecting the
correct section if you wish to enroll in the course.
***Please remember that per the program rules:
""A maximum of six hours may be taken at the 4000-level and/or with a subject code other than CS or CSE.”***
If you have questions about the OMS Analytics program or courses offered through that program, please visit their
website. For the OMS Cybersecurity program and courses offered through that program, please visit their
website for more information."
Course/Program Planning,6,Are there prerequisites for the OMSCS program and/or courses?,"There are no official/enforced prerequisites for the OMSCS courses beyond those required for admission into the
program, so students can take these courses in essentially any order. There are certain recommendations as to
what material/information you should be familiar with prior to taking a course (available in the course descriptions
online), but there are no official prerequisites for the OMSCS courses.
In general we expect students who enter the program to be very comfortable working with multiple programming
languages such as C, Java, and Python (there is no provision within the program to make up any deficiencies)
and to have taken several more advanced topics, such as Advanced OS, Networking, Theory, and/or Algorithms.
More information about this can be found on our website.
If a student needs to take refresher courses before enrolling in OMSCS courses, it is up to the student to find out
how and where to take these kinds of courses, as OMSCS Advising cannot provide advisement for that. Again,
please refer to our website for more information."
Course/Program Planning,7,"After reading the course descriptions, it appears I am only prepared to take “X” course(s). What happens if I am not able to enroll in that specific course(s)?","
Since there are no official prerequisites for our courses (beyond those required for admission into the program),
there is an expectation that students should be prepared for essentially most, if not all, of the OMSCS courses.
Therefore, please do not contact OMSCS Advising requesting to be enrolled in a specific course based on your
qualifications, especially since the advisors are unable to add students to courses and/or wait lists.
Click here to return to Table of Contents
18"
Course/Program Planning,8,Can my advisor help me plan out all of my courses in advance?,"Unfortunately, advisors cannot register students for courses, nor can we add students to wait lists. Therefore, we
cannot guarantee that students will be able to take specific courses during specific semesters, so planning out the
exact ten courses you wish to take (and the semester you wish to take them) most likely is not possible, as
students should plan to be flexible in taking courses whenever they are available.
As a reminder, there are no official/enforced prerequisites for the OMSCS courses (beyond those required for
admission into the program), so students can take these classes in essentially any order. There are certain
recommendations as to what material/information you should be familiar with prior to taking a course, but there
are no official prerequisites for the OMSCS courses. For course-specific prerequisite information, please read the
course descriptions online. Please refer to the FAQ below (#10) for more information on how to plan for future
courses using DegreeWorks."
Course/Program Planning,9,Do I need to take courses in the order they are listed on the specialization webpages?,"No, as mentioned previously, students can take OMSCS courses in essentially any order. Students are not
required to take their specialization courses (or any courses) in a specific order."
Course/Program Planning,10,How can I check my degree progress and/or plan for future courses?,"To check your degree progress and/or plan for future courses, we encourage you to use DegreeWorks. If you
have declared your specialization, DegreeWorks should tell you what requirements, if any, you are missing. It
also should allow you to plan for future courses using the “what if” feature. If you have not yet declared your
specialization, all of your courses should be listed in the ""Fallthrough Section"", as they will not be allocated until
you declare your specialization. Please note that specializations cannot be declared during active periods of
registration. As a reminder, please be sure to review the degree requirements and the specialization
requirements. Alternatively, you can print a degree worksheet for your specialization and fill it in so that you can
see what requirements, if any, are remaining. You may access the degree worksheets online."
Course/Program Planning,11,"There have been some curriculum changes (new course numbers, recently-approved specialization courses, etc.), and my DegreeWorks is not listing these courses in the correct areas of my degree audit.
When will this be adjusted?","If changes are made to the curriculum or a new course number is assigned after you have matriculated,
DegreeWorks will not make the necessary adjustments automatically – the OMSCS advisors have to make
exceptions in DegreeWorks manually. This typically is not done until students have petitioned to graduate, though
you are welcome to contact our office at oms-advising@cc.gatech.edu, and we would be happy to make the
change ahead of time, as long as you already successfully completed the course(s). Please note that we will not
be able to make changes to courses that are still in progress, as we need to ensure that the minimum grade is
earned before making the change in DegreeWorks."
Course/Program Planning,12,Why are my non-CS/CSE courses not being applied to my degree requirements in DegreeWorks?,"Since these courses are outside of the CS/CSE curriculum, your OMSCS advisor will need to manually apply any
non-CS/CSE coursework to your record in DegreeWorks. This typically is not done until students have petitioned
to graduate, though you are welcome to contact our office at oms-advising@cc.gatech.edu, and we would be
happy to make the change ahead of time, as long as you already successfully completed the course(s). Please
note that we will not be able to make changes to courses that are still in progress, as we need to ensure that the
minimum grade is earned before making the change in DegreeWorks."
Course/Program Planning,13,When will the course schedules for each term be available?,"The course schedules for each term are released shortly before the Phase I registration period for each term.
Please refer to the academic calendar for term-specific dates."
Course/Program Planning,14,I completed my bachelor’s degree in Computer Science at Georgia Tech. Can I double-count any of my courses toward my OMSCS degree?,"
Students completing both a bachelor’s and master’s in the same discipline (Computer Science) at Georgia Tech
might be able to use up to six credit hours of graduate-level coursework in the major discipline for both degrees.
Click here to return to Table of Contents
19


To qualify for this option, students must complete the undergraduate degree with a cumulative GPA of 3.5 or
higher and complete the master’s degree within a two-year period from the award date of the bachelor’s degree.
Please visit this website for more information. If you feel you qualify for this option, please send a message from
your GT email account to oms-advising@cc.gatech.edu and include your full name and nine-digit gtID number.
Your advisor will be able to assist you and confirm your eligibility."
Course/Program Planning,15,I earned another master’s degree at Georgia Tech prior to matriculating in the OMSCS program. Can I double-count any of my courses toward my OMSCS degree?,"
Students who have earned another master’s degree at Georgia Tech might be eligible to double-count up to six
hours of previously-earned credit toward their OMSCS degree. Please visit this website for more information
regarding this policy. If you feel you qualify for this, please send a message from your GT email account to
oms-advising@cc.gatech.edu and include your full name and nine-digit gtID number. Your advisor will be able to
assist you and confirm your eligibility."
