category,qns_no,qns,ans
Registration-Related Information,16,I received a “Campus Restriction” or “Major Restriction” error message when trying to add a course. What does this mean?,"
If you receive the “Campus Restriction” or “Major Restriction” error message, this is because you are attempting
to enroll in a course that is not part of the OMSCS program. As a reminder, most OMSCS courses will have a
section of “O” followed by a two-digit number (example: O01, O02, O03, etc.).
Please note that courses with the “OAN” section are for OMS Analytics students only, and courses with
Click here to return to Table of Contents
27


the “OCY” section are for OMS Cybersecurity students only – OMSCS students are NOT permitted to
enroll in these sections.
If a section of an OMS Analytics or OMS Cybersecurity course has been created for OMSCS students, it will have
a section of “O” followed by a two-digit number (as mentioned previously). Therefore, please be sure you are
selecting the correct section if you wish to enroll in the course.
***Please remember that per the program rules:
""A maximum of six hours may be taken at the 4000-level and/or with a subject code other than CS or CSE.”***"
Registration-Related Information,17,What is the difference between “L” and “ALP” in the “BAS” column in OSCAR?,"When searching for courses in OSCAR, the “BAS” column tells you the grade modes accepted for a particular
course. OMSCS courses have the “L” grading basis, which stands for “Letter Grade”, as students may not audit
an OMSCS course or take it on the “Pass/Fail” grading basis.
The one exception are the CS 8001 seminars, as those are graded on the “Pass/Fail” grading basis. As a
reminder, these will NOT count toward your graduation requirements.
You might notice that other courses, such as those offered through the OMS Analytics and OMS Cybersecurity
programs, have the “ALP” grading basis, which stands for “Audit”, “Letter Grade”, and “Pass/Fail”. As a reminder,
courses with the “OAN” section are for OMS Analytics students only, and courses with the “OCY” section are for
OMS Cybersecurity students only – OMSCS students are NOT permitted to enroll in these sections. If a section
of an OMS Analytics or OMS Cybersecurity course has been created for OMSCS students, it will have a section
of “O” followed by a two-digit number as described above. Again, please be sure you are selecting the correct
section if you wish to enroll in the course.
***Please remember that per the program rules:
""A maximum of six hours may be taken at the 4000-level and/or with a subject code other than CS or CSE.”***"
Registration-Related Information,18,What happens if I am not able to register for my course until the first week of classes?,"Professors have access in Canvas to see when students were added to their course. It is our understanding that
students will not be penalized for assignments that were due before the student was registered for the course.
However, please be sure to confirm this with your professor(s) and/or TAs, and please contact them for any other
specific questions you may have regarding their course and/or assignments."
Registration-Related Information,19,What happens if I am not registered by the time Phase II registration has ended?,"Unfortunately, students cannot be added to a course(s) once Phase II registration has ended. Therefore, if you
plan to be enrolled in that specific term, you may need to enroll in a backup course prior to the end of the active
registration period if your first-choice course is not available."
Registration-Related Information,20,"If I am still on the wait list toward the end of the Phase II registration period, will my wait list position carry over to the next semester’s registration period?","
On the last day of Phase II registration, all of the wait lists are cleared, and students are able to enroll in any open
course without needing to go through the wait list first. Therefore, wait lists will not carry over to the next
semester’s registration period."
Registration-Related Information,21,"If there are seats available once Phase II registration has ended, can I be added to the course?","Students cannot be added to a course(s) once Phase II registration has ended, even if there are seats available."
Registration-Related Information,22,I successfully registered for a course. What should I do next?,"Once you have successfully registered for a course, you should log into Canvas to see if you have access to the
course materials. Please see the next FAQ in case you do not see your course materials once you are registered
for the course.
Click here to return to Table of Contents
28"
Registration-Related Information,23,"Classes have started, and I cannot access my course materials and/or Canvas has not been set up for my course. Is this normal?","course. Is this normal?
As stated previously, course materials will be available sometime during the first week of classes. Unfortunately,
we do not have control over when course materials will be available, nor do we have any additional information as
to exactly when course materials will be available. Please note that some professors do not start their classes
until later in the week, so you may not be able to view any course materials even if the semester technically has
started already.
If you register for a course during the first week that classes begin, please note that it can take up to 24 hours
before you can access your course materials. If after this period of time you still cannot access your course
materials, please contact canvas@gatech.edu for Canvas access."
Registration-Related Information,24,"I successfully registered for a course, but Canvas is showing a different course prefix than what is displayed in OSCAR. How do I know if I registered for the correct section?","displayed in OSCAR. How do I know if I registered for the correct section?
Instructors have the ability to edit the “display title” for a course in Canvas. Therefore, when crosslisted sections
of different courses are being taught together, students may encounter times where the course prefix in Canvas is
different than the one listed in OSCAR. For registration/degree-completion purposes, we will rely on your course
registration according to Banner, not Canvas."
Registration-Related Information,25,Can I be switched to another course once the registration period has ended?,"No – unfortunately, even if there are seats available, you cannot be switched to another course once the
registration period has ended. If you no longer wish to be enrolled in the course, you will need to withdraw before
the semester’s withdrawal deadline."
Registration-Related Information,26,What is the difference between dropping and withdrawing from a course?,"When a student drops a course, this action can only be done during active periods of registration (either in Phase
I and/or Phase II). If a student drops a course, the course will not be reflected on their transcript. It will appear as
if the student never registered for the course, according to their transcript. This means that the student will not
have a record of enrollment for the term.
If a student withdraws from a course (this is done after Phase II registration has ended and before the
semester’s withdrawal deadline), this action will result in a “W” on the student’s transcript. If a student withdraws
from a course (or courses) and receives a “W” on the transcript, this counts as a record of enrollment for that
specific term."
Registration-Related Information,27,"If I withdraw from a course and change my mind, can I be re-added to the course?","No – unfortunately, students cannot be re-added to a course once they have withdrawn. Please keep this in mind
as you are deciding whether or not you wish to withdraw from the course (before the withdrawal deadline)."
Registration-Related Information,28,"If I withdraw from a course/semester, do I need to submit a Petition to the Faculty form to enroll the next semester?","No – as per Georgia Tech’s readmission policy, “With the exception of part-time graduate students, any student
who withdraws during a term and wishes to return the following term must complete a Petition to the Faculty Form
only.” Therefore, since OMSCS students are part-time graduate students, you do not need to submit a ""Petition
to the Faculty” form if you withdraw.
Please keep in mind the Satisfactory Academic Progress policy as noted above when considering withdrawing
from the semester."
Registration-Related Information,29,"If I have an open OSI investigation for a course, or if I was found “responsible” at the conclusion of an OSI investigation for a course, am I permitted to withdraw or submit a Petition to the Faculty for a late
withdrawal?","OSI investigation for a course, am I permitted to withdraw or submit a Petition to the Faculty for a late
withdrawal?
Per the Registrar’s website: “If there is an alleged academic integrity violation pending, the student may not drop
the course. The status of the alleged violation is defined as ‘pending’ when an incident has been submitted to the
Office of Student Integrity and has generated an electronic ‘suspected academic misconduct’ notice that has been
sent to the student. If the student is found responsible for any prohibited academic conduct, she/he will not be
Click here to return to Table of Contents
29


allowed to drop the course.”
Additionally: “If the student is found responsible for any prohibited academic conduct in a class, she/he will also
not be allowed to withdraw from the term.”
Finally, a course is not eligible for grade substitution if the student was found responsible for any academic
misconduct in that course, regardless of how many times it is repeated.
Please contact the Registrar’s Office and the Office of Student Integrity if you have any questions regarding this."
Registration-Related Information,30,Will I retain access to my course materials in Canvas after completing a course?,"This is at the discretion of the course instructor. We recommend that students check with the course’s teaching
team during the semester in which you are enrolled so that you can plan accordingly.
Payments & Financial Information"
Payments & Financial Information,1,How do I apply for Financial Aid?,"Please review the Office of Scholarships and Financial Aid’s website for more information and contact their office
with any questions.
Please note that Financial Aid and other programs may have specific credit hour requirements, so be sure to
follow up with their office(s) directly for more information regarding eligibility."
Payments & Financial Information,2,How do I pay for classes? (Note – You do NOT pay for classes until you register for them.),"Please refer to the Bursar’s website and click on “Student Pay” located at the top right of the webpage. Methods
of payment accepted by the Bursar’s Office are cash, check, money order, wire transfers, webchecks, and credit
cards (online only). Please note: there is a third-party service fee when paying by credit card. OMSCS students
are ineligible for the GT Payment Plan."
Payments & Financial Information,3,What is the amount I need to pay?,"Please refer to the Bursar’s website and view the costs by term by reviewing the information under the “Tuition
and Fees” menu."
Payments & Financial Information,4,What is the deadline to pay my fees?,"Please refer to the Bursar’s website for the Fee Payment Deadline for the specific term. If fees are not paid by
the Fee Payment Deadline, class cancellation may occur, and a late fee may be assessed."
Payments & Financial Information,5,What is the process to be reinstated if my schedule is cancelled by the Bursar’s Office due to nonpayment?,"
If your schedule is cancelled for nonpayment, you will be notified by email. Appeals can be submitted by visiting
the Bursar’s website. If you are reinstated into classes, a reinstatement fee of $200.00 will apply, and the account
balance must be paid immediately to avoid re-cancellation.
For questions regarding the fee payment deadline or reinstatement process, please contact the Bursar’s Office
directly (omsbursar.ask@gatech.edu).
Please note: Reinstatement does not guarantee that faculty will allow students to make up any work missed. It is
the student’s responsibility to confirm ahead of being reinstated what accommodations, if any, will be permitted
during the time frame in which the student was not enrolled due to non-payment."
Payments & Financial Information,6,Will I have a record of enrollment if my schedule is cancelled by the Bursar’s Office due to nonpayment?,"If your schedule is cancelled for nonpayment, you will NOT have a record of enrollment for the semester.
Therefore, please note the following:
●
If this is your first semester in the OMSCS program, you will need to defer your admission, if you are
eligible to do so. Please refer to the “Deferring Admission” section of this document for more information
regarding this.
●
If this is not your first semester in the OMSCS program, you will need to make note of whether this will be
Click here to return to Table of Contents
30


your third consecutively-skipped semester. If you will have three or more consecutively-skipped
semesters, you will need to seek readmission in order to enroll in a future semester. Please refer to the
“Taking Time Off” section of this document for more information regarding this."
Payments & Financial Information,7,Why was I charged for health insurance?,"If you believe you have been erroneously charged for health insurance, please contact
grad.ask@grad.gatech.edu for assistance. Note that you may be asked to complete a waiver application form."
Payments & Financial Information,8,"Who should I contact if I have questions regarding financial aid, tuition/fees, my financial student account, or other financial-related questions, such as deferring my previous student loans, tuition
reimbursements for my employer, tax documents that need to be completed by the Institute, etc.?",Please contact the Office of Scholarships and Financial Aid and/or the Bursar’s Office for assistance.
Payments & Financial Information,9,Who should I contact for information regarding my 1098-T?,Please contact the Bursar’s Office for more information regarding your 1098-T.
Payments & Financial Information,10,Who should I contact if I have questions regarding refunds and/or refund eligibility?,"Please contact the Bursar’s Office for more information regarding refunds. Keep in mind that you will receive NO
refund if you are enrolled for more than one class and withdraw from only one course. You only are eligible for a
partial refund if you completely withdraw from school (withdraw from ALL of your courses for the current term).
Taking Time Off"
Taking Time Off,1,Can I take a semester off?,"OMSCS students may take up to two consecutive semesters off at any time after they have matriculated into the
OMSCS program. However, if you take three or more consecutive semesters off, you must apply for readmission.
Please note that the summer term counts as one of the consecutive semesters, even though students are not
required to enroll in the summer term. Unfortunately, there is no guarantee you will be readmitted. For more
information, please review the Registrar's Readmission Policy.
To clarify, if a student enrolls in a course and withdraws (which would result in a “W” on the student’s transcript),
this counts as a record of enrollment for that semester and does not count as sitting out for the semester.
Therefore, the student would need to sit out the next three consecutive semesters before needing to apply for
readmission. If a student drops a course, this does not count as a record of enrollment, and this would be
considered as sitting out a semester.
Please see the FAQ section entitled “Registration-Related Information” for a detailed explanation of the
difference between dropping and withdrawing from a course.
Please note: If you are a newly-admitted student and are not planning to attend your first semester, you will need
to submit a request to defer your admission. Please refer to the “Deferring Admission” section of the FAQ for
more information about how and when to submit this request."
Taking Time Off,2,What is the process once students seek readmission?,"Students must complete the step-by-step instructions on the Registrar’s readmission website. After they have
successfully submitted their readmission application (by following the step-by-step instructions), the information is
sent to the Registrar’s Office where initial processing is completed. They then submit your readmission packet to
our office, and we process everything on our end.
If you have been academically dismissed, we will prepare and send you the graduate readmission contract. Once
we receive the signed copy from you, or if you do not require the readmission contract, we will submit everything
to the Executive Director or Director of OMSCS Advising for review. After they have made their recommendation
as to whether or not your readmission application should be approved, we will submit everything to the Registrar’s
Office for a final decision and processing. You will be notified by their office once a final decision has been made.
Please note that there are different deadlines when you are seeking readmission as a student who has been
academically dismissed versus a student who has taken three or more consecutive semesters off.
Click here to return to Table of Contents
31"
Taking Time Off,3,What is the difference between readmitting versus reapplying to the OMSCS program?,"Readmission is for current OMSCS students who matriculated into the program and then took time off (either
voluntarily or as a result of being academically dismissed). Students are considered to have matriculated if they
registered in at least one course and earned a grade, even if the grade was a withdrawal (“W”).
Reapplying (or submitting a full new application to the OMSCS program) is for admitted students who did not
matriculate and are already outside of their one-year deferral timeframe. For example, if your original application
term is Spring 2024, you would need to reapply to the program if you wish to matriculate after Spring 2025 
To summarize: ●
Current OMSCS students who have been academically dismissed and/or who have taken three or more
consecutive semesters off must seek readmission.
●
Admitted students who have not yet matriculated into the OMSCS program must reapply if they are past
the one-year deferral time frame from their original application term."
Taking Time Off,4,"If I am readmitted, will my previously-earned credits still count?","Yes — your eligible, previously-earned credits will count toward your OMSCS degree if you are approved for
readmission (subject to the six-year program completion rule). To clarify, it is not possible to “start over” or “erase”
your previous academic history, as that always will be a part of your student record."
Taking Time Off,5,What if I need to seek readmission but have not fulfilled my foundational requirement as of yet?,"We will address your foundational requirement as part of the readmission application process, so there is nothing
additional that you need to do regarding this when seeking readmission."
Taking Time Off,6,Is there anything I need to do if I wish to take a semester off?,"If you wish to take a semester off, you simply should not enroll in a course for that term. If you are registered for a
future term, please be sure to drop your course(s) once you have an active time ticket so that you are not charged
tuition/fees. You do not need to notify your advisor or complete/submit any forms. Please keep the readmission
policy in mind, as you will need to seek readmission if you skip three or more consecutive semesters (including
the summer semester).
Also, please remember that Summer registration and Fall Phase I registration may take place at the same time,
unless noted otherwise. If you are planning to skip the summer semester but will enroll for the fall, you should
plan to register for the fall semester during Phase I. If you miss the Phase I registration period, you will have
another chance to enroll during Phase II (though course availability most likely will be more limited)."
Taking Time Off,7,Can I work as a TA during a semester that I am not enrolled in a course?,"OMSCS students can work as a TA during a semester in which they are not enrolled, only if they do not need to
seek readmission. If they are in their third consecutively-skipped semester and will need to seek readmission to
enroll in a future semester, then they are not eligible to be a TA."
Taking Time Off,8,What if I need to take an extended amount of time off from school due to an extenuating circumstance,"(such as required military service, maternity/paternity leave, scheduled surgery, etc.)?
Students may be eligible for an approved Leave of Absence. Please review Section C of the academic catalog for
more information. If you have any questions regarding the Leave of Absence policy, please be sure to contact the
Registrar’s Office directly.
Please note the following regarding the Leave of Absence policy:
●
The Leave of Absence cannot be approved retroactively.
●
An approved Leave of Absence would be effective in a future term. Students on an approved Leave of
Absence would not have to apply for readmission and would be able to retain their email accounts during
the approved absence. Prior to returning, the student would have to notify the Registrar’s Office so that
their record could be reactivated for re-entry.
Click here to return to Table of Contents
32


●
The Leave of Absence would cover eligible students for at least three and no more than seven semesters
(including summer). If the seventh semester is a spring term, students may opt to return in either the
summer or fall term.
●
Students on an approved Leave of Absence may not attend class or access other campus services.
●
The form to request an approved Leave of Absence is on the Registrar’s Office’s website.
○
Please be sure to use your advisor’s direct email address (NOT
oms-advising@cc.gatech.edu) when submitting this form via DocuSign.
●
The Leave of Absence may be used more than once but for no more than seven total semesters during
the student’s enrollment at Georgia Tech.
●
Students who have been placed on academic drop, suspended, or expelled for disciplinary reasons may
not participate.
●
Students must clear up any other issues such as registration holds or providing any requested
documentation prior to re-entry. The approved Leave of Absence does not override other considerations
or restrictions on enrollment.
●
Students should apply for a Leave of Absence as soon as possible. Applications for a Leave of Absence
will require review and signatures by the Office of the Dean of Students and the student’s major academic
advisor. Other signature approvals, such as the Office of International Education and Financial Aid, also
may need to be obtained.
○
Students should bear in mind the time limits in determining the anticipated date of return.
○
As a reminder, readmission is required when three or more consecutive terms have been missed
(the summer term counts as one of the consecutive semesters, even though students are not
required to enroll in the summer term). However, once students have made the decision that they
will have to or need to be out for three or more consecutive terms, and the students wish to return
to Georgia Tech without being readmitted, the application for a Leave of Absence should be filed
with the Registrar’s Office.
○
The clock begins when the student does not enroll for a third consecutive term. The Leave of
Absence would have to be in effect for the third consecutive missed term to avoid readmission.
●
Students must file a Return from Leave of Absence form to return. If the leave exceeds the
seven-semester time frame, the student must apply for readmission. The form is available on the
Registrar’s Office’s website under the “Forms” menu.
●
As stated previously, the Leave of Absence, if approved, would be effective in a future term. It will not be
approved to be effective in the term in which the application is made. It in no way supplants or replaces
any other policy. If a student needs to withdraw from classes within a given term, they should follow the
standard withdrawal process, and if a Leave of Absence is needed or desired, it would be effective for a
future term(s) only as approved.
●
Applications for a Leave of Absence are due by:
○
Fall – July 1
○
Spring – December 1
○
Summer – April 1
Graduation"
Graduation,1,When do students need to apply for graduation?,"Students will need to apply for graduation in the semester preceding the semester they plan to graduate. For
example, students who will be graduating by the end of the Spring 2024 term were asked to apply for graduation
during the Fall 2023 term. OMSCS Advising will send email notifications with step-by-step instructions on how
and when to apply for graduation.
Please note that our departmental deadline is earlier than the posted Institute deadline for students’ benefit. If the
advisors do not have time to process/audit students’ graduation application materials before the registration
period ends for the anticipated graduation term, we cannot ensure that students will meet their degree
requirements by the end of that term."
